{
  "event_id": "evt_01H8TESTDOCREVISION000000000",
  "tenant_id": "ten_local",
  "doc_id": "doc_0123456789ab",
  "version": 2,
  "type": "doc.revision_committed",
  "schema_version": 1,
  "occurred_at": "2026-09-16T10:02:00.000Z",
  "actor": { "participant_id": "par_01H8TESTAGENT0000000000", "kind": "agent" },
  "causation_id": null,
  "correlation_id": null,
  "payload": {
    "doc_id": "doc_0123456789ab",
    "base_version": 1,
    "version": 2,
    "ops": [
      {
        "op": "append",
        "block_id": null,
        "block": { "block_id": "blk_01", "type": "heading", "text": "# 目标" }
      },
      {
        "op": "insert_after",
        "block_id": "blk_01",
        "block": { "block_id": "blk_02", "type": "paragraph", "text": "第一周完成存储层与聚合" }
      },
      {
        "op": "replace",
        "block_id": "blk_02",
        "text": "第一周完成存储层、聚合与 HTTP 契约"
      },
      {
        "op": "delete",
        "block_id": "blk_99"
      }
    ],
    "actor": "par_01H8TESTAGENT0000000000",
    "source": "agent",
    "note": "起草目标小节并修订措辞"
  },
  "metadata": {}
}
